{
  "creatureStatistics": {
    "name": "Rabbit",
    "health": 50,
    "maxHealth": 50,
    "mana": 0,
    "maxMana": 0,
    "attack": 0,
    "attackSlowness": 40,
    "defense": 5,
    "speed": 100,
    "outfit": {
      "id": 74
    }
  },
  "fluidType": 0,
  "experience": 0,
  "behaviour": {
    "type": "FRIENDLY",
    "fleeHealth": 50,
    "openDoors": true,
    "senseInvisible": false
  },
  "corpse": 3119,
  "loot": [
    {"id": 2666, "probability": 1, "min": 1, "max": 3}
  ],
  "sayings": {
   "texts": ["Mip mip mip"],
   "slowness": 300,
   "chance": 0.75
  }
}