{
  "creatureStatistics": {
    "name": "Sheep",
    "health": 5,
    "maxHealth": 5,
    "mana": 0,
    "maxMana": 0,
    "attack": 0,
    "attackSlowness": 40,
    "defense": 5,
    "speed": 30,
    "outfit": {
      "id": 13
    }
  },
  "fluidType": 0,
  "experience": 0,
  "corpse": 2914,
  "behaviour": {
    "type": "FRIENDLY",
    "fleeHealth": 4,
    "openDoors": false,
    "senseInvisible": false
  },
  "loot": [
    {"id": 2666, "probability": 1, "min": 1, "max": 3}
  ],
  "sayings": {
   "texts": ["Behhh"],
   "slowness": 300,
   "chance": 0.75
  }
}