{
  "creatureStatistics": {
    "name": "Cave Rat",
    "health": 30,
    "maxHealth": 30,
    "mana": 0,
    "maxMana": 0,
    "attack": 8,
    "attackSlowness": 40,
    "defense": 5,
    "speed": 30,
    "outfit": {
      "id": 56
    }
  },
  "fluidType": 0,
  "experience": 10,
  "behaviour": {
    "type": "HOSTILE",
    "fleeHealth": 0,
    "openDoors": true,
    "senseInvisible": false
  },
  "corpse": 2813,
  "loot": [
    {
      "id": 2148,
      "probability": 1,
      "min": 1,
      "max": 4
    },
    {
      "id": 2696,
      "probability": 0.1,
      "min": 1,
      "max": 1
    }
  ],
  "sayings": {
    "texts": [
      "Meep!",
      "Meeeeep!"
    ],
    "slowness": 300,
    "chance": 0.75
  }
}