{
  "creatureStatistics": {
    "name": "Skeleton",
    "health": 50,
    "maxHealth": 50,
    "attack": 10,
    "mana": 0,
    "maxMana": 0,
    "attackSlowness": 40,
    "defense": 10,
    "speed": 50,
    "outfit": {
      "id": 33
    }
  },
  "fluidType": 2,
  "experience": 35,
  "corpse": 2843,
  "behaviour": {
    "type": "HOSTILE",
    "fleeHealth": 0,
    "openDoors": true,
    "senseInvisible": false
  },
  "loot": [
    {
      "id": 2229,
      "probability": 1,
      "min": 1,
      "max": 1
    },
    {
      "id": 2230,
      "probability": 1
    },
    {
      "id": 2231,
      "probability": 1
    },
    {
      "id": 2148,
      "probability": 1,
      "min": 1,
      "max": 7
    },
    {
      "id": 2473,
      "probability": 0.5
    }
  ],
  "spells": [{
    "id": 6,
    "chance": 1,
    "cooldown": 50
  }],
  "sayings": {
    "texts": [
      "Rattle!"
    ],
    "slowness": 300,
    "chance": 0.75
  }
}